id,job_id,job_slug,created_at,updated_at,posted_date,posted_time,posted_timestamp,posted_tsrange,title_id,title,linkedin_company_id,company_name,company_universal_name,location_geo_id,location,address_country,address_locality,address_region,postal_code,street_address,latitude,longitude,applicants,applicant_range_id,description,linkedin_seniority_level_id,linkedin_employment_type_id,job_functions,industries,salary_range,salary_currency_id,salary_min,salary_max,salary_unit,required_months_of_experience,academic_qualification,recruiter_profile_id,recruiter_slug_id,apply_external_url,external_job_id,valid_until,benefit_ids,closed_since
534297069,3168913238,travel-rn-ed-emergency-department-at-vivian-health-3168913238,2022-08-20T10:28:52.578606,2022-08-20T10:28:52.578606,,,,"[""2022-05-19 10:28:48.620645"",""2022-08-23 10:28:48.620645"")",265876130,Travel RN - ED - Emergency Department,18506580,Vivian Health,vivianhealth,,"Berwyn, IL",,,,,,,,0,A,"Focus Staff is seeking a travel nurse RN ED - Emergency Department for a travel nursing job in Berwyn, Illinois.<br/><br/><strong><u>Job Description &amp; Requirements<br/></u></strong><ul><li>Specialty: ED - Emergency Department</li><li>Discipline: RN</li><li>Start Date: 08/15/2022</li><li>Duration: 13 weeks</li><li>36 hours per week</li><li>Shift: 12 hours</li><li>Employment Type: Travel<br/></li></ul>Focus Staff Job ID #a1q4w000006ksPSAAY. Pay package is based on 12 hour shifts and 36 hours per week (subject to confirmation) with tax-free stipend amount to be determined. Posted job title: Travel ER RN - Emergency Room RN Registered Nurse<br/><br/><strong><u>About Focus Staff<br/><br/></u></strong>Focus Staff is a travel healthcare professional staffing agency. We place awesome people in awesome places across every state in the U.S. and the Virgin Islands. If you're an adventurer or a facility that needs high-quality staff, give us a shot. One promise we can unequivocally make: we'll always be totally honest and transparent. Period.",13,5,{77},{6},,,,,,,,,,,,,,2022-08-20T10:28:48.622704
534297033,3167696972,tx-campus-custodian-basis-medical-center-immediate-opening-at-basis-ed-3167696972,2022-08-20T10:28:50.31734,2022-08-28T15:19:04.987554,,00:00:00,,"[""2022-05-27 15:19:01.487611"",""2022-08-23 10:28:46.652441"")",274384758,TX: Campus Custodian - BASIS Medical Center [Immediate Opening],2130187,BASIS.ed,basis-educational-group,102396835,"San Antonio, TX",,,,,,,,0,A,"BASIS Medical Center is seeking qualified candidates for a Campus Custodian to join our bright, passionate team!<br/><br/><strong>WE ARE NATIONALLY RANKED<br/><br/></strong>BASIS Curriculum Schools have been consistently ranked among the best schools in the United States. It is a reflection of the quality of the BASIS Curriculum, dedication of our expert educators, and hard work of incredible students. Our schools offer students an education that prepares them according to the highest, most rigorous international standards.<br/><br/>The top five high schools in the United States are BASIS Curriculum Schools, as are six of the nation’s top eight, and seven of America’s top fourteen, according to U.S. News &amp; World Report’s annual rankings.<br/><br/><strong>Job Summary: </strong>The Campus Custodian will clean and maintain the school or other educational facility.<br/><br/><strong><u>Duties/Responsibilities<br/></u></strong><ul><li>Performs general cleaning and janitorial duties in the common areas of the building.</li><li>Performs minor repairs and maintenance such as replacing light fixtures or unclogging pipes.</li><li>Assists in cleaning and sanitizing restrooms and cafeteria.</li><li>Performs limited grounds maintenance such as mowing and trimming lawns and hedges and cleaning snow from sidewalks.</li><li>Ensures heating and cooling systems are operational.</li><li>Maintains a neat and orderly janitors room; ensures cleaning and maintenance supplies are stocked.</li><li>Washes windows.</li><li>Assists in examining school for safety hazards; reports deficiencies to lead custodian, principal, and/or school resource officer.</li><li>Performs other related duties as assigned.<br/></li></ul><strong><u>Required Skills/Abilities<br/></u></strong><ul><li>Knowledge of safety hazards and proper use of various cleaning and sanitizing solutions.</li><li>Detail-oriented and thorough.</li><li>Ability to perform basic repairs and operate tools or equipment used in routine maintenance.</li><li>Ability to keep the school clean and orderly.</li><li>Ability to interact with staff, students, parents, and visitors at school while remaining professional, polite, and courteous.<br/></li></ul><strong><u>Education And Experience<br/></u></strong><ul><li>High school diploma or equivalent required.</li><li>Must pass a background check.<br/></li></ul><strong><u>Supervisory Responsibilities<br/></u></strong><ul><li>None.<br/></li></ul><strong><u>Physical Requirements<br/></u></strong><ul><li>Prolonged periods standing.</li><li>Must be able to lift, bend, stoop, climb, reach, and lift up to 50 pounds at a time.<br/></li></ul><strong><u>Additional Job Information<br/><br/></u></strong>Benefits and Hourly Pay: Hourly pay rate for this position is competitive and dependent on education and experience. BASIS.ed offers a comprehensive benefits package.<br/><br/>NOTE: All employees of BASIS.ed are required to obtain and maintain a valid fingerprint clearance.<br/><br/>Notice of Non-Discrimination: In accordance with Title VI of the Civil Rights Act of 1964, Title IX of the Education Amendments of 1972, Section 504 of the Rehabilitation Act of 1973, the Age Discrimination Act of 1975, Title II of the Americans with Disabilities Act of 1990, the Boy Scouts of America Equal Access Act and applicable state law, BASIS* does not discriminate on the basis of actual or perceived race, color, religion, national origin, sex, age, disability, gender identity or expression, or any other classification protected by law in any of its business activities, including its educational programs and activities which comply fully with the requirements of state and federal law and Title IX. The following person has been designated to handle inquiries regarding BASIS’ non-discrimination policies: Beverly Traver, Compliance and Equity Investigator, BASIS Educational Group, LLC., 7975 N. Hayden Rd, Scottsdale, AZ 85258, (480) 289-2088.<br/><ul><li>As used in this policy, the term ""BASIS"" refers to: BASIS Educational Group, LLC, BASIS Charter Schools, Inc., BTX Schools, Inc., BDC, A Public School, Inc., BBR Schools, Inc., and all affiliated entities.</li></ul>",3,1,"{13,85}",{69},,,,,,,,,,https://basised.clearcompany.com/careers/jobs/3486bd60-1600-61f9-6b30-2fcbe57030a3/apply?source=2136342-JB-1018,,,,2022-08-25T01:58:03.635241
534297034,3167697102,%E6%9C%BA%E5%99%A8%E5%AD%A6%E4%B9%A0%E7%AE%97%E6%B3%95%E5%B7%A5%E7%A8%8B%E5%B8%88-at-%E4%B8%89%E8%B5%A2%E5%A5%8B%E6%96%97%E8%80%85%E5%88%9B%E6%96%B0%E4%BA%BA%E6%89%8D%E7%AE%A1%E7%90%86-3167697102,2022-08-20T10:28:50.340857,2022-08-20T10:28:50.340857,,,,"[""2022-05-19 10:28:46.722847"",""2022-08-23 10:28:46.722847"")",24469,机器学习算法工程师,,三赢奋斗者创新人才管理,,,"Chengdu, Sichuan, China",,,,,,,,0,A,职位来自于拉勾<br/><br/>岗位要求<br/><br/>1、全曰制研究生及以上学历，计算机、通信、电子、软件及其相关专业，5年以上工作经验；<br/><br/>2、有良好的数学基础和编<br/><br/>程能力，熟悉Python，C++编程语言；<br/><br/>3、深入了解机器学习、模式识别等领域的相关算法（如逻辑回归、SVM、神经网络、决策树、贝叶斯、Gradient Boost、KNN、K-Means等）；<br/><br/>4、熟悉CNN、RNN、LSTM等典型深度学习模型的使用场景和使用方法 ，熟悉TensorFlow、Pytorch等主流深度学习框架中的一种或者多种；<br/><br/>5、极强的学习能力，能够快速理解垂直领域的业务逻辑；<br/><br/>6、有GPGPU(OpenCL/CUDA)并行编程经验的优先；<br/><br/>7、有扎实的语言功底和文字呈现能力，严谨细致、有责任心，具有团队合作精神<br/><br/>岗位职责<br/><ul><li>参与边缘深度学习算法部署和优化，进行核心算法工程化和优化。</li><li>参与图像处理、识别算法设计、实现及性能优化。</li><li>参与搭建公司自研的深度学习模型训练与推理框架<br/></li></ul>4、负责AI相关计算数据处理技术研发与应用等；<br/><br/>5、参与人工智能项目和现有平台的开发<br/><br/>6、模型、算法和平台的搭建<br/><br/>7、项目业务支持：作为技术人员，必要时为商务人员或交付人员提供支持。,6,1,"{13,8}",{25},,,,,,,,,,,,,,2022-08-20T10:28:46.727238
534297046,3169720459,registered-nurse-at-derbyshire-healthcare-nhs-foundation-trust-3169720459,2022-08-20T10:28:51.786085,2022-08-20T10:28:51.786085,,,,"[""2022-05-19 10:28:47.264584"",""2022-08-23 10:28:47.264584"")",10414,Registered Nurse,475876,Derbyshire Healthcare NHS Foundation Trust,derbyshire-healthcare,,"Derby, England, United Kingdom",,,,,,,,0,A,"<strong>How You'll Apply For This Job<br/><br/></strong>We're updating the design of NHS Jobs and the way you apply.<br/><br/>This means you'll apply for this job through a new updated version of the website.<br/><br/><strong>If you've already got an NHS Jobs account<br/><br/></strong>You'll need to create a new NHS Jobs account and apply for this job through the new version.<br/><br/>You'll still have access to your current NHS Jobs account. For example, you can sign in and view your profile, your applications, and you can copy and paste any information from there into your new account, if you need to.<br/><br/>You'll have these 2 accounts while there's a 'current' and 'new' version of the website. Your new account will replace your current account when the website design is fully updated.<br/><br/><strong>If you've not got an NHS Jobs account<br/><br/></strong>You'll need to continue and create one to apply for this job.<br/><br/><strong>If you want to access the website in Welsh<br/><br/></strong>The new NHS Jobs website is also available in Welsh. Choose the Welsh (Cymraeg) option on the new NHS Jobs website to change the language from English to Welsh.",13,1,{77},{14},,,,,,,,,,,,,,2022-08-20T10:28:47.269203
523240527,3218448055,%E6%99%BA%E8%83%BD%E5%8C%96%E8%AE%BE%E8%AE%A1%E5%B8%88-at-%E8%8A%9C%E6%B9%96%E9%AB%98%E7%A7%91%E7%94%B5%E5%AD%90-3218448055,2022-08-12T09:16:41.349822,2022-08-24T23:24:41.432313,2022-07-18,06:08:24,2022-07-18T06:08:24,"[""2022-07-08 09:16:38.75186"",""2022-07-26 08:22:59.331889"")",13591,智能化设计师,,芜湖高科电子,,90009562,Guangzhou-Foshan Metropolitan Area,CN,Guangzhou-Foshan Metropolitan Area,,,,23.09509,113.14473,0,A,职位来源于智联招聘。<br/><br/>岗位职责：<br/><br/>1、了解弱电设备现场安装以及深入掌握弱电智能化工程技术，精准理解客户要求；<br/><br/>2、根据用户需求编制智能化工程设计方案（含方案、图纸、造价、标书），<br/><br/>3、负责完成智能化方案汇报交流；<br/><br/>4、售前技术方面控制；<br/><br/>5、配合业务员做好项目的投标报价工作。<br/><br/>任职资格：<br/><br/>1、本科以上学历，计算机、电力电子类相关专业，具备基本的计算机网络知识；<br/><br/>2、一年以上独立进行方案设计的经验，了解智能化项目的规划设计、招投标过程，对项目的运作过程清晰的了解。<br/><br/>3、能够熟练运用CAD制图技能，掌握word、excel、ppt等相关软件使用；<br/><br/>4、有弱电工程项目规划经验者优先；<br/><br/>5、有弱电工程调试维护或施工经验者优先。<br/><br/>7、具体薪资根据工作经验年限来定。<br/><br/>薪酬福利：<br/><br/>1、 待遇优渥，五险一金；<br/><br/>2、 双休，享受法定节假日；<br/><br/>3、 其他福利：定期体检，年度旅游、高温补贴、节日福利、婚育礼金等等。<br/><br/>以担保或任何理由索要财物，扣押证照，均涉嫌违法。,16,1,"{13,72,75}",{6},,,,,,,,,,https://m.zhaopin.com/in-landing?jobid=CC397898710J40129524710,CC397898710J40129524710,2022-09-11T06:08:24,,2022-08-24T23:24:35.863524
523360181,3218527091,%E8%AF%BE%E7%A8%8B%E9%A1%BE%E9%97%AE-at-%E7%83%9F%E5%8F%B0%E5%BC%80%E5%8F%91%E5%8C%BA%E7%88%B1%E7%AC%9B%E8%92%99%E6%95%99%E8%82%B2%E5%9F%B9%E8%AE%AD%E5%AD%A6%E6%A0%A1%E6%9C%89%E9%99%90%E5%85%AC%E5%8F%B8-3218527091,2022-08-12T10:32:18.326026,2022-08-20T10:28:50.49282,,07:01:53,,"[""2022-07-08 10:32:16.218186"",""2022-07-26 10:00:56.342404"")",15837,课程顾问,,烟台开发区爱笛蒙教育培训学校有限公司,,90009562,Guangzhou-Foshan Metropolitan Area,,,,,,,,0,A,职位来源于智联招聘。<br/><br/>工作职责 ：<br/><br/>课程咨询、客户接待；<br/><br/>有教育行业工作经验者优先。<br/><br/>职位要求：<br/><br/>男女不限，18周岁以上，专科及以上学历，应届、往届毕业生均可，热爱教育事业，积极向上。<br/><br/>薪资及福利待遇：<br/><br/>1、无责底薪+补贴+业绩提成（高提成）；<br/><br/>2、交纳五险（养老保险+医疗保险+生育保险+失业保险+工伤保险）；<br/><br/>3、提供住宿；<br/><br/>4、应届毕业生可提供网签；<br/><br/>5、公司提供专业及晋升培训、节假日福利、生日会、团队活动、员工福利活动等。<br/><br/>以担保或任何理由索要财物，扣押证照，均涉嫌违法。,21,1,"{7,87}",{70},,,,,,,,,,https://m.zhaopin.com/in-landing?jobid=CCL1210726570J40277358606,,,,2022-08-20T07:13:28.29174
523240504,3218444714,%E5%85%89%E7%94%B5%E5%AF%BC%E5%B8%88-%E5%85%89%E7%94%B5%E5%92%A8%E8%AF%A2%E5%B8%88%EF%BC%88%E5%B8%82%E5%9C%BA%EF%BC%89-at-%E5%8C%97%E4%BA%AC%E7%BE%8E%E9%94%A6%E6%88%90%E7%AE%A1%E7%90%86%E5%92%A8%E8%AF%A2%E6%9C%89%E9%99%90%E5%85%AC%E5%8F%B8-3218444714,2022-08-12T09:16:40.039431,2022-08-24T23:24:41.459214,2022-07-18,06:08:34,2022-07-18T06:08:34,"[""2022-07-08 09:16:36.610534"",""2022-07-26 08:23:01.372316"")",257218573,光电导师/光电咨询师（市场）,65021119,北京美锦成管理咨询有限公司,北京美锦成管理咨询有限公司,90009562,Guangzhou-Foshan Metropolitan Area,CN,Guangzhou-Foshan Metropolitan Area,,,,23.09509,113.14473,0,A,职位来源于智联招聘。<br/><br/>（北京市场，负责北京区域直营店 5-7 家）<br/><br/>岗位职责：<br/><br/>1、负责区域的科美门店项目落地、追踪与完成，确保完成业绩目标；<br/><br/>2、针对面部光电项目销售压单（独立成单能力优先）；<br/><br/>3、男女不限，光电导师和操作师搭配，导师负责销售压单。<br/><br/>任职要求：<br/><br/>1、形象好气质佳，销售能力强，22-40岁之间；<br/><br/>2、有美容导师、市场老师、厂家老师、美容店长经验优先；<br/><br/>3、有光电老师，医美渠道咨询、市场咨询经验优先；<br/><br/>工作时间：早10:00-18:00，下店根据各店面时间；<br/><br/>工作地点：北京80多家直营连锁门店分配5-7家；<br/><br/>公司福利：高于同行业薪酬+带薪年假+晋升+节假日福利<br/><br/>薪资待遇：前期保底，后期底薪+销售提成+奖金，综合收入20000-50000，做高取高。<br/><br/>集团公司，直营门店，配合度高，客户流量大。<br/><br/>以担保或任何理由索要财物，扣押证照，均涉嫌违法。,16,1,{80},{11},,,,,,,,,,https://m.zhaopin.com/in-landing?jobid=CC430464320J40247155516,CC430464320J40247155516,2022-09-11T06:08:34,,2022-08-24T23:24:36.234548
534297070,3168913228,sr-engineer-rf-test-engineer-onsite-at-raytheon-technologies-3168913228,2022-08-20T10:28:52.593084,2022-08-20T10:28:52.593084,,,,"[""2022-04-18 10:28:48.822072"",""2022-07-26 10:28:48.822072"")",246947543,Sr Engineer - RF Test Engineer (onsite),40653509,Raytheon Technologies,raytheontechnologies,,"Dallas, TX",,,,,,,,0,A,"<strong><u>Job Description<br/><br/></u></strong>Exciting opportunity for an Electrical Engineer to work in the Hardware Electronic Center of Raytheon's RI&amp;S division, at our facility in North Dallas, Texas. The candidate will have responsibility for the verification of RF products including (Transmit-Receive Integrated Modules) while supporting product manufacturing and test. The candidate will become a member of an integrated product team, inclusive of design, process, and test. Responsibilities include formulating test verification methods and systems, supporting resolution of manufacturing and test issues and encouraging continuous improvement projects. Additionally, the position requires (1) monitoring of manufacturing and test data on a daily basis to identify defect trends and working with process and manufacturing engineering to resolve any issues identified, (2) implementing needed electrical design changes, verifying performance of modified circuits, and updating corresponding electrical requirements and specifications. (3) Formulating next generation test strategies and methods to improve test times and test performance in general.<br/><br/>The position provides growth opportunities, including customer and supplier interaction and the opportunity to transition to future module design or systems roles.<br/><br/><strong><u>Required Skills<br/></u></strong><ul><li> Demonstrated experience in RF test methods, systems, and equipment with experience in the application of statistics to data to formulate decisions on behalf of the team</li><li> Experience in the authoring of requirements and verification documentation, inclusive of test plans and procedures</li><li> Experience production test of RF/Microwave modules</li><li> Experience with simulation instrument such ADS, HFSS or equivalent</li><li> PNA general-purpose network analyzer experience<br/><br/></li></ul><strong><u>Desired Skills<br/></u></strong><ul><li> Demonstrated communication skills<br/><br/></li></ul><strong><u>Required Education<br/><br/></u></strong>BSEE in Electrical Engineering<br/><br/><strong>Desired Education<br/><br/></strong>MSEE in Electrical Engineering<br/><br/><strong><em><u>This position requires either a U.S. Person or a Non-U.S. Person who is eligible to obtain any required Export Authorization.<br/><br/>U.S. Citizenship status is required as this position needs ability to obtain U.S. Secret Security Clearance<br/><br/></u></em></strong>Location: Dallas TX<br/><br/>Relocation Eligible<br/><br/><em>Employee Referral Award Eligibility: Only employees currently within RMD and RI&amp;S have the potential to receive a Referral Award for submitting a referral to RMD and RI&amp;S roles. ALL eligibility requirements must be met to receive the Referral Awarding.<br/><br/></em><strong>Raytheon Technologies is An Equal Opportunity/Affirmative Action Employer. All qualified applicants will receive consideration for employment without regard to race, color, religion, sex, sexual orientation, gender identity, national origin, disability or veteran status, age or any other federally protected class.</strong>",3,1,"{13,8}",{1},,,,,,,,,,,,,,2022-08-20T10:28:48.82419
534297035,3229495250,a-p-mechanic-at-aerotek-3229495250,2022-08-20T10:28:50.560265,2022-08-20T10:28:50.560265,,,,"[""2022-08-20 02:28:49.389266"",""2022-08-20 05:28:49.389266"")",455167,A&P Mechanic,2889,Aerotek,aerotek,,"Kansas City, MO",,,,,,,,0,A,"<ul><li>Description:*</li><li>Perform routine and non-routine maintenance and repair on primarily general aviation aircraft</li><li>Aircraft may include Piper, Pilatus, King Air, Cessna Citation, and Bonanza models</li><li>Additional Skills &amp; Qualifications:*</li><li>2+ years of Aircraft Maintenance experience required</li><li>A&amp;P License is required</li><li>Experience working on general aviation aircraft preferred</li><li>Tools must be provided by the candidate</li><li>Pay:* * $28/hr - $44/hr, depending on experience</li><li>Per Diem split available for those who qualify</li><li>Work Schedule:*</li><li>1st Shift, Monday through Friday</li><li>Unlimited OT is available and entirely voluntary</li><li>There may be an opportunity to move to 2nd Shift, 3rd Shift, or Weekend Shift in the future</li><li>Placement Options (Both Options are Available):*</li><li>6-month Contract to Hire</li><li>Direct Hire</li><li>Why Work Here?:*</li><li>Work for a company and owners that are proud to be employee-centric and family-first</li><li>The company is growing and there will be opportunity to expand your career with them long-term</li><li>There are great benefits if you go direct with them:</li><li>Medical</li><li>Vision (fully paid by company)</li><li>Dental (fully paid by company)</li><li>Life Insurance (fully paid by company)</li><li>8-10 vacation days and an additional 8-10 days of PTO per year</li><li>401K with company match</li><li>Relocation assistance may be available on a case-by-case basis<br/><br/></li></ul>About Aerotek:<br/><br/>We know that a company's success starts with its employees. We also know that an individual's success starts with the right career opportunity. As a Best of Staffing® Client and Talent leader, Aerotek's people-focused approach yields competitive advantage for our clients and rewarding careers for our contract employees. Since 1983, Aerotek has grown to become a leader in recruiting and staffing services. With more than 250 non-franchised offices, Aerotek's 8,000 internal employees serve more than 300,000 contract employees and 18,000 clients every year. Aerotek is an Allegis Group company, the global leader in talent solutions. Learn more at Aerotek.com. The company is an equal opportunity employer and will consider all applications without regards to race, sex, age, color, religion, national origin, veteran status, disability, sexual orientation, gender identity, genetic information or any characteristic protected by law.",3,1,"{13,8}",{104},,,,,,,,,,,,,,2022-08-20T10:28:49.39166
534297036,3229484889,carpenter-at-aerotek-3229484889,2022-08-20T10:28:50.609833,2022-08-20T10:28:50.609833,,,,"[""2022-08-20 02:28:49.736095"",""2022-08-20 05:28:49.736095"")",1036,Carpenter,2889,Aerotek,aerotek,,"Tulsa, OK",,,,,,,,0,A,"<ul><li>Description:* Repairs mobile offices units to blueprint specs using a variety of hand and power tools Perform task related to carpentry, electrical, plumbing, and HVAC such as repairing drywall, faucets, doors and windows, flooring, replacing outlets and light fixtures, etc.</li><li>Skills:* construction, carpentry, tools, framing, electrical, Installation, Hand tool, building material, drywall, painting, trim, carpentry</li><li>Top Skills Details:* construction, carpentry, tools,framing</li><li>Additional Skills &amp; Qualifications:* Ideal candidate will have at least one year working in construction, electrical, plumbing or carpentry experience with experience using hammers, screwdrivers, wrenches, and other hand and power tools. Carpentry or woodworking experience is preferred but not required.<br/><br/></li></ul>Candidates with a willingness to learn are perfect.<br/><ul><li>Experience Level:* Entry Level<br/><br/></li></ul>About Aerotek:<br/><br/>We know that a company's success starts with its employees. We also know that an individual's success starts with the right career opportunity. As a Best of Staffing® Client and Talent leader, Aerotek's people-focused approach yields competitive advantage for our clients and rewarding careers for our contract employees. Since 1983, Aerotek has grown to become a leader in recruiting and staffing services. With more than 250 non-franchised offices, Aerotek's 8,000 internal employees serve more than 300,000 contract employees and 18,000 clients every year. Aerotek is an Allegis Group company, the global leader in talent solutions. Learn more at Aerotek.com. The company is an equal opportunity employer and will consider all applications without regards to race, sex, age, color, religion, national origin, veteran status, disability, sexual orientation, gender identity, genetic information or any characteristic protected by law.",3,4,{82},{104},,,,,,,,,,,,,,2022-08-20T10:28:49.738304
534297038,3169473900,administrative-assistant-at-driveline-studios-3169473900,2022-08-20T10:28:50.950832,2022-08-20T10:28:50.950832,,,,"[""2022-05-19 10:28:46.68462"",""2022-08-23 10:28:46.68462"")",85,Administrative Assistant,73417914,Driveline Studios,driveline-studios,,Detroit Metropolitan Area,,,,,,,,0,A,"Seeking an Administrative Assistant to help our small but growing team thrive. The perfect team member is someone who gets energy and fulfillment from a mix of entrepreneurial spirit, tenacity, task completion. Our team takes on a lot of projects with multiple high-performance clients and the right Administrative Assistant will be someone who loves working with our team to maximize our client relationships.<br/><br/>Driveline Studios specializes in Marketing, Advertising, Social Media, Content Creation, and Design for the high-performance aftermarket.<br/><br/>Daily tasks may include schedule / email management, estimating / invoicing projects, client meetings, client deliverable tracking and routing.<br/><br/>• Being well-organized<br/>• Being courteous<br/>• Reliability<br/>• Strong work ethic<br/>• Productivity<br/>• Professionalism<br/>• Problem-solving and critical thinking skills<br/>• Good technical, interpersonal and communication skills<br/>• Customer focus<br/>• Discretion<br/>• Multitasking ability<br/><br/>This role will be 85% remote with some on-site work in the Detroit Metro area and/or the Indianapolis area. Some travel may be required.<br/><br/>Thank you for looking and good luck on your search!",,1,{},{},,,,,,,,752054528,522660157,,,,,2022-08-20T10:28:46.687504
