id,job_id,job_slug,created_at,updated_at,posted_date,posted_time,posted_timestamp,posted_tsrange,title_id,title,linkedin_company_id,company_name,company_universal_name,location_geo_id,location,address_country,address_locality,address_region,postal_code,street_address,latitude,longitude,applicants,applicant_range_id,description,linkedin_seniority_level_id,linkedin_employment_type_id,job_functions,industries,salary_range,salary_currency_id,salary_min,salary_max,salary_unit,required_months_of_experience,academic_qualification,recruiter_profile_id,recruiter_slug_id,apply_external_url,external_job_id,valid_until,benefit_ids,closed_since
528891303,3223666905,teacher-reading-5-fte-and-english-as-a-second-language-5-fte-gr-6-12-sei-endorsement-required-sy22-23-anticipated-vacancy-at-boston-public-schools-3223666905,2022-08-16T08:53:25.094198,2022-08-24T12:44:27.577271,2022-08-15,00:00:00,2022-08-15,"[""2022-08-13 10:28:43.287878"",""2022-08-16 08:53:23.730008"")",274384754,"Teacher - Inclusion (.5 FTE) and English as a Second Language (.5 FTE), Gr. 6-12 (SEI Endorsement Required) (SY22-23) (Anticipated Vacancy)",5955,Boston Public Schools,bostonpublicschools,102380872,"Boston, MA",US,Boston,MA,,,42.358994,-71.05863,0,A,"This position is an anticipated vacancy. It is expected to be vacant by 08/27/2022. However, the current incumbent has a right to rescind their retirement, leave, or resignation up until the day of the expected vacancy date. Your hire will not be confirmed until the position is vacated, and you may start the year as a Long-Term Substitute if the position does not become vacant by the start of the school year.<br/><ul><li>This school has been designated as a Level 4 school by the State of Massachusetts. This designation allows districts to utilize the new tools granted in the landmark education reform law that was passed in 2010 to provide additional services for these schools. Some of these tools will allow for extended time and extra compensation where needed.<br/></li></ul>Boston Public Schools seeks an exceptional Inclusion and ENGLISH AS A SECOND LANGUAGE TEACHER with an SEI Endorsement who is highly qualified and knowledgeable to join our community of teachers, learners and leaders. This is an exciting opportunity for teachers who desire to serve where their efforts matter. In BPS, the teachers and leaders are committed to the vision of high expectations for achievement, equal access to high levels of instruction, the achievement of academic proficiency for all students, and the closing of the achievement gap among subgroups within the schools. BPS is a great place for those who seek to work in an environment that supports their creativity and innovation, and respects their skills and abilities as a teacher.<br/><br/>REPORTS TO: Principal<br/><br/><strong><u>Responsibilities<br/><br/></u></strong>Teach: Reading in an SEI setting<br/><ul><li>Creatively provide an interdisciplinary course of study that incorporates state curricular frameworks. </li><li>Be in alignment with skills and content embodied in the school’s curriculum map.<br/></li></ul>CORE COMPETENCIES: Using the Rubric of Effective Teaching, the Office of Human Capital has identified priority skills and abilities that all BPS teachers should possess:<br/><ul><li> Accountability for Student Achievement <br/></li></ul><em>(II-A-1. Quality of Effort and Work, II-D-2. High Expectations, </em><em>I-B-2. Adjustments to Practice)<br/></em><ul><li>Sets ambitious learning goals for all students, creates cognitively demanding tasks, and models the belief that that all students can master challenging material through effective effort</li><li>Assesses students’ understanding regularly with ambitious learning goals in mind and takes ownership of making necessary adjustments to instruction to reach goals despite setbacks</li><li>Passionate and optimistic about their students, their content, and the teaching profession</li><li> Communicating Content Knowledge<br/></li></ul><em>(I-A-1. Subject Matter Knowledge, I-A-4. Well-Structured Lessons)<br/></em><ul><li>Demonstrates mastery of and enthusiasm for content area and the pedagogy it requires</li><li>Demonstrates understanding for how the subject matter applies in real-world settings and connects to other content areas and relevant standards</li><li>Can convey content in creative and engaging ways that align to standards</li><li> Equitable &amp; Effective Instruction <br/></li></ul><em>(II-A-3. Meeting Diverse Needs, II-A-2. Student Engagement, II-B-1. Safe Learning Environment)<br/></em><ul><li>Scaffolds and differentiates instruction in order for all students to do complex thinking and rigorous academic work</li><li>Uses instructional practices that are likely to challenge, motivate, and engage all students and facilitate equitable, active student participation</li><li>Builds a productive learning environment where every student participates and is valued as part of the class community</li><li> Cultural Proficiency <br/></li></ul><em>(II-C-1. Respects Differences, II-C-2. Maintains Respectful Environment)<br/></em><ul><li>Actively creates and maintains an environment in which students’ diverse backgrounds, identities, strengths, and challenges are respected</li><li> Parent/Family Engagement <br/></li></ul><em>(III-A-1. Parent/Family Engagement)<br/></em><ul><li>Engages with families and builds collaborative, respectful relationships with them in service of student learning</li><li> Professional Reflection &amp; Collaboration <br/></li></ul><em>(IV-A-1. Reflective Practice, IV-C-1. Professional Collaboration)<br/></em><ul><li>Regularly reflects on practice, seeks and responds to feedback, and demonstrates self-awareness and commitment to continuous learning and development</li><li>Seeks to participate in and contribute to a collaborative adult learning community.<br/></li></ul>QUALIFICATIONS__REQUIRED:<br/><ul><li>Education: Hold a Bachelors degree.</li><li>Hold a valid Massachusetts Teaching License in Moderate Disabilities AND either an SEI Endorsement OR ESL license at the appropriate grade level.</li><li>Meet all state and federal guidelines in order to be fully licensed and Highly Qualified.</li><li>Ability to meet the Standards of Effective Teaching established by the Boston Public Schools as outlined above.</li><li>Current authorization to work in the United States - Candidates must have such authorization by their first day of employment.<br/></li></ul>QUALIFICATIONS__PREFERRED:<br/><ul><li>Experience teaching in urban schools.</li><li>Degree in Education.</li><li>BPS values linguistic diversity and believes that candidates who speak another language bring added value to the classroom, school, and district culture and diversity. BPS is particularly interested in candidates who are fluent in one of BPS' official languages:Spanish, Creole (Cape Verdean), Creole (Haitian), Chinese, Vietnamese, Portuguese, &amp; Somali.</li><li>In order to best serve all students, BPS prefers all core content teachers to be certified in their subject area and one or both of the following: Moderate Disabilities, English as a Second Language (at the appropriate grade level(s)).<br/></li></ul>Terms: BTU, Group I<br/><br/>Please refer to www.bostonpublicschools.org/ohc (under ""Employee Benefits and Policies"") for more information on salary and compensation. Salaries are listed by Unions and Grade/Step.<br/><br/>The start and end times of BPS schools vary, as do the lengths of the school day. Some BPS schools have a longer school day through the ""Schedule A"" Expanded Learning Time (ELT) agreement. To learn more about ELT at BPS and whether or not this school is a ""Schedule A"" ELT school, check here: https://www.bostonpublicschools.org/Page/6571. To see the bell schedule for every BPS school, go to: https://www.bostonpublicschools.org/Page/7017. Please note, these times may be subject to change prior to the start of the school year.<br/><br/>The Boston Public Schools, in accordance with its nondiscrimination policies, does not discriminate in its programs, facilities, or employment or educational opportunities on the basis of race, color, age, criminal record (inquiries only), disability, homelessness, sex/gender, gender identity, religion, national origin, ancestry, sexual orientation, genetics or military status, and does not tolerate any form of retaliation, or bias-based intimidation, threat or harassment that demeans individuals’ dignity or interferes with their ability to learn or work.",3,1,"{7,87}",{69},,,,,,,bachelor degree,,,https://bostonpublicschools.tedk12.com/hire/ViewJob.aspx?JobID=29856,tedk12-bostonpublicschools-29856,2022-09-15T04:41:15,,
528776318,3223668978,manager-technical-insurance-risk-sydney-at-kpmg-australia-3223668978,2022-08-16T07:05:57.515035,2022-08-24T12:44:27.639871,2022-08-16,05:15:49,2022-08-16T05:15:49,"[""2022-08-16 03:53:22.374478"",""2022-08-16 06:53:22.374478"")",273844760,Manager - Technical Insurance Risk - Sydney,2639873,KPMG Australia,kpmg-australia,103320399,"Newcastle, New South Wales, Australia",AU,Newcastle,NSW,,,-32.92921,151.77002,0,A,"<strong>KPMG Risk Strategy &amp; Technology – Who are we? <br/><br/></strong>KPMG Risk Strategy &amp; Technology is a specialist Consulting Team dedicated to helping clients achieve commercial outcomes, by viewing risk management as a lever for enhanced innovation, reputation and sustainable growth. Some of our areas of expertise include Risk Strategy – understanding risk capacity to inform strategic direction and decision-making, Governance – looking at Risk Operating Models and Risk Culture &amp; Conduct – aligning risk culture and behavioural policies. We work with many Tier 1 Organisations in Australia and Globally particularly across Financial Services, Infrastructure, Health, FMCG, Retail, Logistics, Technology, Energy and Defence. Due to the ongoing demand from our clients that Risk Management underpins nearly every single strategic initiative, our service line continues to enjoy healthy growth and spotlight year on year. We take pride in our diversity in both background and identity including accountants, lawyers, management consultants and business professionals from varying ethnicities, genders, beliefs and orientations.<br/><br/><strong>Common Questions we Solve <br/><br/></strong>How do executives prepare their business for emerging areas of risk?<br/><br/>What needs to be done to allow the Insurance industry to prepare themselves for the shift in regulatory expectations?<br/><br/>How can organisations leverage regulatory change to drive better organisational outcomes?<br/><br/>What is required to embed the desired risk culture organisationally?<br/><br/><strong>Your Opportunity – Manager <br/><br/></strong>As a Manager within the Risk Strategy &amp; Technology team you’ll be responsible for the day to day running of client engagements, playing a project-management like role in delivery engagements for key Insurance clients. You’ll be the SME and point of contact for general enquiries and escalations, stepping in where required to gather more information or provide guidance as an Experienced Risk Professional.<br/><br/>Internally you’ll be working with the leadership group to ensure that delivery is optimised, commercial targets are on track and resourcing is adequately addressed. On the client-side you’ll be involved in review presentations, day to day reports and may have the responsibility of managing a team. As a Manager your day to day may look like this.<br/><ul><li>Design Reviewing risks with associated processes, controls, frameworks and functions including gap analysis, design, operation and outputs.</li><li>Engage Partnering with control owners to deliver targeted projects which uplift quality of risk and control matrices.</li><li>Measure Help to track and measure effectiveness of controls, ensuring they are robust and operationally effective.</li><li>Utilising your knowledge of operational and compliance risks executing targeted project work to mitigate risk.</li><li>Documentation and reporting of control gaps, undocumented controls and highlighting potential high-risk areas.</li><li>Managing internal team budgets, deliverables and engagements.</li><li>Coaching Senior Leadership on best practice risk management methodology while driving a culture of high performance and ethical business practices.</li><li>Presenting findings and reports to Senior Leadership both client-facing and internal.</li><li>Identifying opportunities for business development and revenue generation.</li><li>Building strong relationships with clients, ensuring that service deliverables are being met and exceeded where possible.</li></ul> <br/> <br/><strong><u>Key Requirements<br/></u></strong><ul><li>Experience working within the Insurance industry across risk, compliance, product, pricing, distribution, claims or underwriting.</li><li>Relevant tertiary qualifications ideally having or working towards a CA/CPA/CIA equivalent post-tertiary qualification is advantageous.</li><li>Must have a logical / structured understanding of risk management through operational and enterprise risk lenses.</li><li>Effective communication skills both verbal and written, able to articulate examples of dealing with difficult stakeholders, problem solving, process improvements.</li><li>High level of organisation and ability to manage conflicting deadlines, priorities and wide variety of work engagements.</li><li>Ability to quickly build strong relationships and network with a variety of stakeholders both internal and external.</li></ul>",21,1,"{13,8}","{11,43,47}",,,,,,,,,,https://www.gobeyond.kpmg.com.au/experienced/en/job/519402/manager-technical-insurance-risk-sydney?lApplicationSubSourceID=11281,519402,2022-09-15T05:15:48,,
509747529,3197725146,electroinc-engineer-at-continental-3197725146,2022-08-02T03:29:09.396496,2022-08-30T21:26:08.287314,2022-07-07,18:13:18,2022-07-07T18:13:18,"[""2022-06-28 03:29:04.849335"",""2022-07-19 03:29:04.849335"")",53394264,Electroinc Engineer,3534,Continental,continental,112884409,"Manesar, Haryana, India",IN,Manesar,,,,28.357395,76.93673,101,E,"<strong>Description<br/><br/></strong><ul><li> To select Electronics components such away that to meet customer requirement</li><li> To support plant Quality and Testing team, to resolve electronic related issues and Queries</li><li> To perform electronic product level and system level test to confirm its meet customer requirement<br/><br/></li></ul><strong>Qualifications<br/><br/></strong>To arrange supportive electronic document for product release package on time with right quality<br/><br/><ul><li> To perform target wheel evaluation every project</li><li> To Prepare Electrical test plan</li><li> To interact global team and get it align functional safety management document</li><li> To support function verification of all development stage samples</li><li> To better co-ordinate with plant testing team and support EOL test bench topic</li><li> To create Electronic DFMEA</li></ul>",3,1,{8},"{96,53,4}",,,,,,,bachelor degree,,,https://www.continental-jobs.com/index.php?ac=jobad&id=1868231,1868231,2022-08-31T18:13:18,,
534206908,3229520987,engineering-manager-iii-at-andersen-corporation-3229520987,2022-08-20T09:03:04.349347,2022-08-31T00:08:56.837858,2022-08-22,,,"[""2022-08-22 00:00:00"",""2022-08-23 00:00:00"")",19285722,Engineering Manager III,2776,Andersen Corporation,andersen,102736137,"Bayport, MN",US,Bayport,MN,,,45.01857,-92.77982,0,A,"Job Name:<br/><br/>Engineering Manager III<br/><br/>General information<br/><br/><strong>Location: </strong>Bayport, MN<br/><br/>Date:<br/><br/>17-Aug-2022<br/><br/>Company:<br/><br/>Andersen Corporation<br/><br/>Ref #:<br/><br/>2028<br/><br/>Job Category:<br/><br/>Engineering, Research and Development<br/><br/>Bayport<br/><br/>MN<br/><br/><strong>Description &amp; Requirements<br/><br/></strong><strong>POSITION RESPONSIBILITIES<br/><br/></strong><strong>Purpose<br/><br/></strong>The Enterprise Technology and Innovation manager is focused on leading multiple enterprise technology competency areas that are integral to Andersen’s current and future product and services strategy. The purpose of this role is to use customer insights to drive technology innovation and application to ensure Andersen current and new products and services are different and better, distinctive, and are based on a resilient supply chain that optimizes overall cost.<br/><br/><strong>Job Responsibilities: <br/></strong><ul><li>Provides technical leadership for the Enterprise across multiple technology competency areas.</li><li>Drives innovation, technology development, and technology support projects based on customer insight, technology trends, and business direction. </li><li>Provides leadership for additional centralized functions of RDI including testing services, engineering services, and broader technology scouting. </li><li>Establishes the RD &amp; I portfolio of projects to support the above strategy ensuring the right balance between innovation, new products, line extensions, cost savings, and quality.</li><li>Accountable for technical integrity of and building confidence when implementing these solutions within all divisions.</li><li>Establishes with legal our intellectual property strategy on new technology developments.</li><li>Advances our engineering services (e.g., testing, certification programs) to assure state of the art performance in our new products and compliance to certification programs.</li><li>Ensures ongoing external awareness of technology, competitors, and emerging &amp; disruptive technologies &amp; opportunities.</li><li>Provides regular status reports to senior business leaders, cross functional partners, and other potential customers/clients. </li><li>Uses customer insights throughout the development process to ensure projects deliver a world-class customer experience.<br/><br/></li></ul><strong> Minimum Qualifications:<br/></strong><ul><li>Bachelor’s degree in engineering or science-related field</li><li>10+ years technical management experience</li><li>Proven experience and success in developing and implementing technology change</li><li>Strong analytical skills and aptitude for problem solving<br/><br/></li></ul><strong>Preferred Qualifications:<br/></strong><ul><li>3+ years leading early-stage technology development initiatives focused on new materials, processes, or equipment &amp; tools</li><li>Experience in managing multiple innovation projects and broader portfolios</li><li>Strong aptitude in material development, process development, manufacturing scale-up, and/or equipment design &amp; procurement </li><li>Strong understanding of relevant methodologies and tools (e.g., DFSS, Design Thinking, DMAIC, development Stage Gates, PMBOK, Lean)</li><li>Strong knowledge of R&amp;D, manufacturing, business, and quality systems</li><li>Experience working with internal and external business and development partners</li><li>Experience working with larger corporations as well as smaller startups <br/><br/></li></ul>Andersen is an equal opportunity employer and all qualified applicants will receive consideration for employment without regard to race, color, religion, sex, sexual orientation, gender identity or expression, pregnancy, age, disability, marital status, national origin, citizenship, genetic information, protected veteran status, or any other characteristic protected by law.<br/><br/><strong>Profit Sharing<br/><br/></strong>During 2022, each eligible Andersen employee will receive $1,000 for each full fiscal quarter they are actively employed and fully vaccinated against COVID-19. An eligible employee hired during a quarter will receive a prorated payment based on the number of days employed during the quarter. Those eligible include fully-vaccinated regular full-time and part-time employees (at least 20 hours per week) who are not subject to a collective bargaining agreement. These and other terms and conditions of Andersen’s 2022 Profit Sharing Plan, including the definition of full vaccination against COVID-19, are subject to change or termination without notice.",16,1,"{13,8}","{49,133}",,,,,,120,bachelor degree,,,https://careers.andersencorp.com/careers/JobDetail/Engineering-Manager-III/2088,2088,2022-09-19T08:40:36,,2022-08-28T16:09:48.316626
528966215,3223700322,3d-texturing-artist-v-ray-at-superdna-3d-lab-3223700322,2022-08-16T10:00:56.847863,2022-08-20T10:28:47.845021,2022-08-16,09:26:53.501055,2022-08-16T09:26:53.501055,"[""2022-08-16 09:25:53.501055"",""2022-08-16 09:28:53.501055"")",270422154,3D Texturing Artist - V Ray,18335986,SuperDNA 3D Lab,superdna3dlab,,India,,,,,,,,0,A,"<p>Texture artist will be responsible for :</p><p><br/></p><p>Producing benchmark materials and textures using Vray in 3DS Max</p><p>Must have knowledge of procedural workflow.</p><p>Create high quality, accurate models and UV’s based on references.</p><p>Implement improvements/changes based on feedback and lead direction.</p><p>Texture assets using a wide range of reference material and tools.</p><p>Work with the defined pipeline.</p><p>Troubleshoot creative and technical issues as they arise.</p><p>Work closely with the modeling team to ensure the created model will work through a real time assets pipeline.</p><p>Work with a production schedule and follow strict deadlines.</p><p>Ability to work as part of a team, be resourceful and self-driven.</p><p>Follow directory structure, naming conventions and other guidelines for surfacing files.</p><p>Overseeing and developing the material library.</p><p>Assisting in designing, implementing and maintaining material pipelines.</p><p>Share knowledge and techniques with team members to improve overall team skills and asset quality.</p><p>Join team meetings.</p><p>Help other creative team members to improve with any new found knowledge.</p>",,1,{},{},,,,,,,,-15136351,646264387,,,,,2022-08-20T10:28:42.487859
523240388,3218447231,java%E5%BC%80%E5%8F%91%E5%B7%A5%E7%A8%8B%E5%B8%88-at-%E8%A7%86%E8%81%94%E5%8A%A8%E5%8A%9B%E4%BF%A1%E6%81%AF%E6%8A%80%E6%9C%AF%E8%82%A1%E4%BB%BD%E6%9C%89%E9%99%90%E5%85%AC%E5%8F%B8-3218447231,2022-08-12T09:16:33.373107,2022-08-24T23:24:35.120103,2022-07-31,08:03:04,2022-07-31T08:03:04,"[""2022-07-23 10:28:42.304668"",""2022-08-09 08:22:56.709247"")",27830,java开发工程师,30290244,视联动力信息技术股份有限公司,视联动力信息技术股份有限公司,90009562,Guangzhou-Foshan Metropolitan Area,CN,Guangzhou-Foshan Metropolitan Area,,,,23.09509,113.14473,0,A,职位来源于智联招聘。<br/><br/>岗位职责：<br/><br/>1、参与公司产品的需求分析、设计、JAVA程序开发、测试工作；<br/><br/>2、根据要求，参与编写相关设计文档、部署文档等；<br/><br/>3、参与软件系统的系统架构设计、关键技术问题攻关工作；<br/><br/>4、研究开发相关的技术细节；完成程序的单元测试；根据需要不断修改完善软件；<br/><br/>5、完成上级领导交办的其他工作。<br/><br/>任职要求：<br/><br/>1、本科以上学历。三年以上的JAVA开发经验。<br/><br/>2、熟悉设计模式，熟练使用主流开源框架，如STRUTS、SPRING、HIBERNATE、IBATIS等。<br/><br/>3、熟悉各种WEB前端技术，AJAX/CSS/JAVASCRIPT/JQUERY，HTML5等；<br/><br/>4、熟悉 nio，多线程开发<br/><br/>5、使用TOMCAT或WEBLOGIC等应用服务器软件的管理、配置、开发和测试<br/><br/>以担保或任何理由索要财物，扣押证照，均涉嫌违法。,16,1,"{13,8}",{8},,,,,,,bachelor degree,,,https://m.zhaopin.com/in-landing?jobid=CC397785110J00086085012,CC397785110J00086085012,2022-09-11T06:08:40,,2022-08-24T23:24:26.51732
