id,job_id,job_slug,created_at,updated_at,posted_date,posted_time,posted_timestamp,posted_tsrange,title_id,title,linkedin_company_id,company_name,company_universal_name,location_geo_id,location,address_country,address_locality,address_region,postal_code,street_address,latitude,longitude,applicants,applicant_range_id,description,linkedin_seniority_level_id,linkedin_employment_type_id,job_functions,industries,salary_range,salary_currency_id,salary_min,salary_max,salary_unit,required_months_of_experience,academic_qualification,recruiter_profile_id,recruiter_slug_id,apply_external_url,external_job_id,valid_until,benefit_ids,closed_since
534296922,3169720634,caregiver-cna-%24300-sign-on-bonus-at-comfort-keepers-3169720634,2022-08-20T10:28:44.835531,2022-08-20T10:28:44.835531,,,,"[""2022-05-19 10:28:38.161253"",""2022-08-23 10:28:38.161253"")",9625431,Caregiver / CNA - $300 Sign on Bonus,19449,Comfort Keepers,comfort-keepers,,"Brighton, MI",,,,,,,,0,A,"Become a part of our Comfort Keepers team! We are actively seeking warm-hearted, dedicated individuals who have a passion for making a difference in the lives of others. Experience is preferred but no experience is required for fast learners with a passion for helping others.<br/><br/>Caregivers will provide one-on-one care to the elderly in Farmington Hills, Livonia, and Novi areas.<br/><br/>9:30am-12:30pm 5 days per week (Farmington Hills female client<br/><br/>8am-12pm - 6 days per week (Walled Lake - female client)<br/><br/>9am-1pm 7 days a week (Livonia female client)<br/><br/>7pm-7am 7 days a week (Northville male client)<br/><br/>Many other great opportunities!<br/><br/><strong><u>Why Caregivers Want To Work For Us<br/><br/></u></strong>We appreciate our caregivers!!<br/><br/>Weekly Pay<br/><br/>Paid Time Off<br/><br/>Direct Deposit<br/><br/>Dental and Vision Benefits<br/><br/>401(k) with Company Match<br/><br/>Mileage reimbursement for driving on job<br/><br/>We strive to match our caregivers to clients who are close to their own homes<br/><br/>Holiday Pay (Double Time)<br/><br/>Referral bonuses and rewards program<br/><br/>Flexible hours - we'll work around your schedule!<br/><br/>Extensive Paid Training - online and hands-on, as well as ongoing professional development opportunities<br/><br/>24-hour support and the tools you need to be successful on the job<br/><br/>Join our team and enjoy a rewarding career with Comfort Keepers, where we treat each client with the respect and dignity we would extend to a member of our own family.<br/><br/>Responsibilities and Duties<br/><br/>We provide in-home support and assistance to help seniors and others in need maximize quality of life and maintain independence!<br/><br/>Core job responsibilities include traveling to clients' homes and assisting them with:<br/><br/>Bathing, showering, toileting<br/><br/>Meal preparation &amp; feeding<br/><br/>Dressing &amp; grooming<br/><br/>Light housekeeping, laundry, organizing incoming mail<br/><br/>Grocery shopping, running errands<br/><br/>Recreational activities<br/><br/>Transferring and providing transportation to doctor, beauty salon, etc<br/><br/>We can't wait to meet you!<br/><br/>~~Apply today!~~<br/><br/>Call(248) 919-7620with questions or to schedule your interview<br/><br/>http://www.MICareJobs.com<br/><br/>Comfort Keepers is strongly considering candidates with previous experience as a Caregiver, CNA, Home Health Aide, Personal Care Aide/Assistant, or similar positions. We offer a great paid training program for those with backgrounds in other industries interested in working in the medical field. You'd be a great fit if your background is in customer service, retail, hotel, restaurant - server, host, or bartender.<br/><br/>Job Types: Full-time, Part-time, Temporary<br/><br/>Pay: $12.00 - $14.00 per hour<br/><br/><strong><u>COVID-19 Considerations<br/><br/></u></strong>We provide PPE for all employees, hospital-strength cleaning supplies for all clients, and screen all clients and employees daily for COVID-19 symptoms. We do not provide care to clients with COVID-19.<br/><br/><strong><u>Required<br/><br/></u></strong><strong>Preferred<br/><br/></strong><strong>Job Industries<br/></strong><ul><li> Healthcare</li></ul>",3,1,{80},{88},,,,,,,,,,,,,,2022-08-20T10:28:38.16586
534296923,3169271011,%E7%B3%BB%E7%BB%9F%E7%AD%96%E5%88%92-%E6%94%BE%E7%BD%AE%E7%B1%BB-at-%E5%90%89%E6%AF%94%E7%89%B9-3169271011,2022-08-20T10:28:44.85529,2022-08-20T10:28:44.85529,,,,"[""2022-05-19 10:28:38.844891"",""2022-08-23 10:28:38.844891"")",273029842,系统策划(放置类),9457189,G-bits Game,厦门吉比特网络技术股份有限公司,,"Shenzhen, Guangdong, China",,,,,,,,0,A,职位来自于拉勾<br/><br/>岗位职责：<br/><br/>1、按主策划需求完成游戏子系统的设计思路，确保设计思路逻辑清晰，不偏离于游戏的整体框架；<br/><br/>2、根据设计思路，完成系统详细设计文档，包括玩法说明、美术需求、操作UI说明、数值配置说明等；<br/><br/>3、与美术程序沟通，确保玩法的最终实现符合设计需求；<br/><br/>4、对系统设计文档进行整理和更新，确保文档归档的及时性。<br/><br/>任职要求：<br/><br/>1、拥有丰富的游戏经验，有2年以上大型游戏系统设定的工作经验；<br/><br/>2、熟悉策划文档编写；熟练运用office办公软件，文字组织能力较好；<br/><br/>3、性格开朗灵活，沟通能力强；<br/><br/>4、利用脚本或者编辑器，完成系统的相关配置工作；<br/><br/>5、工作积极主动，踏实肯干，有敬业精神；不介意加班与拥有强大执行力者优先。,16,1,"{13,81}",{109},,,,,,,,,,,,,,2022-08-20T10:28:38.849655
534296924,3169271006,php%E5%90%8E%E7%AB%AF%E5%BC%80%E5%8F%91%E4%B8%AD%E7%BA%A7%E5%B7%A5%E7%A8%8B%E5%B8%88-at-%E4%BC%81%E6%80%9D%E5%A6%99%E6%83%B3%E5%93%81%E7%89%8C%E7%AD%96%E5%88%92-3169271006,2022-08-20T10:28:44.881459,2022-08-20T10:28:44.881459,,,,"[""2022-05-19 10:28:39.086834"",""2022-08-23 10:28:39.086834"")",272312864,php后端开发中级工程师,,企思妙想品牌策划,,,"Chengdu, Sichuan, China",,,,,,,,0,A,职位来自于拉勾<br/><br/>岗位职责：<br/><br/>1，负责产品的需求分析，后端详细设计，构架设计以及开发工作；<br/><br/>2，负责系统核心功能代码编写、解决项目中遇到的技术难点<br/><br/>3，对项目已有的技术进行优化，提高项目的性能以及稳定；<br/><br/>4，能独立负责项目后端，参与技术方案选型，包括框架选型，缓存模型设计以及线上运维；<br/><br/>5，负责公司旗下项目现有功能的维护、完善、新功能的研发<br/><br/>6，负责数据库的应用开发与管理维护，协调数据库设计，保证符合数据库设计规范和性能需求<br/><br/>岗位要求:<br/><ul><li> ***本科及以上学历，计算机相关专业；</li><li> 6年后端PHP开发工作经验，有独立开发能力；</li><li> 有大中型web应用开发经验，精通TP及Laravel框架，熟悉常用开源框架、应用；<br/></li></ul>4，精通使用MYSQL，具备基本的数据库设计和优化经验，熟悉常用优化方案；<br/><br/>5，熟悉Radis等缓存技术，掌握Git版本控制工具的基本操作；<br/><br/>6，拥有良好的编码习惯，要求结构清晰，命名规范，逻辑性强，代码冗余率低；<br/><br/>7，工作态度积极主动、认真负责，具有较强的执行力和学习能力，有较强的工作热情。<br/><br/>8，具有小程序开发相关经验，CRM及OA类管理系统开发经验优先<br/><br/>9、具有丰富的系统重构与代码审查经验者优先.,16,1,"{13,8}",{91},,,,,,,,,,,,,,2022-08-20T10:28:39.091225
534296928,3169271016,%E6%B5%8B%E8%AF%95%E5%BC%80%E5%8F%91%E5%B7%A5%E7%A8%8B%E5%B8%88-%E4%BC%81%E4%B8%9A%E6%95%88%E7%8E%87%E6%96%B9%E5%90%91-at-%E5%B0%8F%E7%BA%A2%E4%B9%A6-3169271016,2022-08-20T10:28:44.920656,2022-08-20T10:28:44.920656,,,,"[""2022-05-19 10:28:39.161035"",""2022-08-23 10:28:39.161035"")",271057347,测试开发工程师-企业效率方向,10269563,Xiaohongshu,xiaohongshu,,"Shanghai, Shanghai, China",,,,,,,,0,A,职位来自于拉勾<br/><br/>工作职责<br/><br/>负责小红书企业效率方向质量保障工作<br/><br/>任职资格<br/><br/>1.5年以上服务端测试经验，企业效率背景优先<br/><ul><li>具备较强的编码能力，熟悉服务端各项测试手段</li><li>有从0到1测试工具开发落地经验优先</li></ul>,6,1,{22},{25},,,,,,,,,,,,,,2022-08-20T10:28:39.165578
534297261,3168912848,class-2-hiab-driver-at-interaction-recruitment-3168912848,2022-08-20T10:29:05.137954,2022-08-20T10:29:05.137954,,,,"[""2022-05-19 10:28:59.974579"",""2022-08-23 10:28:59.974579"")",159270,Class 2 HIAB Driver,535954,Interaction Recruitment,interaction-recruitment,,"Ipswich, England, United Kingdom",,,,,,,,0,A,Class 2 Drivers (HIAB) Urgently Required<br/><br/>Based in Ipswich<br/><br/>Delivering building supplies throughout the local area<br/><br/>Desirable<br/><ul><li>Clean driving licence </li><li>Excellent geographic knowledge </li><li>Experience in a similar role <br/></li></ul>Must have<br/><ul><li>Digital Tachograph Card </li><li>Certificate of Professional Competence Card (CPC) </li><li>HIAB Certificate </li><li>Hi – Viz and safety boots<br/></li></ul>08:00 start<br/><br/>£13 per hour,3,1,"{79,78}",{104},,,,,,,,,,,,,,2022-08-20T10:28:59.976811
534296925,3169720754,band-6-junior-sister-charge-nurse-critical-care-at-barking-havering-and-redbridge-university-hospitals-nhs-trust-3169720754,2022-08-20T10:28:44.889538,2022-08-20T10:28:44.889538,,,,"[""2022-05-19 10:28:38.572249"",""2022-08-23 10:28:38.572249"")",251315066,Band 6 Junior Sister/Charge  Nurse-Critical Care,1702677,"Barking, Havering and Redbridge University Hospitals NHS Trust",barking-redbridge-and-havering-nhs-trust,,"Havering, England, United Kingdom",,,,,,,,0,A,"<strong>How You'll Apply For This Job<br/><br/></strong>We're updating the design of NHS Jobs and the way you apply.<br/><br/>This means you'll apply for this job through a new updated version of the website.<br/><br/><strong>If you've already got an NHS Jobs account<br/><br/></strong>You'll need to create a new NHS Jobs account and apply for this job through the new version.<br/><br/>You'll still have access to your current NHS Jobs account. For example, you can sign in and view your profile, your applications, and you can copy and paste any information from there into your new account, if you need to.<br/><br/>You'll have these 2 accounts while there's a 'current' and 'new' version of the website. Your new account will replace your current account when the website design is fully updated.<br/><br/><strong>If you've not got an NHS Jobs account<br/><br/></strong>You'll need to continue and create one to apply for this job.<br/><br/><strong>If you want to access the website in Welsh<br/><br/></strong>The new NHS Jobs website is also available in Welsh. Choose the Welsh (Cymraeg) option on the new NHS Jobs website to change the language from English to Welsh.",3,1,"{79,78}",{14},,,,,,,,,,,,,,2022-08-20T10:28:38.576822
534296926,3169271001,%E4%BA%A7%E5%93%81%E7%BB%8F%E7%90%86-at-%E5%8C%97%E4%BA%AC%E6%99%93%E7%BE%8A%E6%95%99%E8%82%B2%E7%A7%91%E6%8A%80%E6%9C%89%E9%99%90%E5%85%AC%E5%8F%B8-3169271001,2022-08-20T10:28:44.8974,2022-08-20T10:28:44.8974,,,,"[""2022-05-19 10:28:38.966389"",""2022-08-23 10:28:38.966389"")",13790,产品经理,29888605,北京晓羊教育科技有限公司,北京晓羊教育科技有限公司,,"Beijing, Beijing, China",,,,,,,,0,A,职位来自于拉勾<br/><br/>岗位职责：<br/><br/>1、根据集团产品战略、行业和市场研究，管理产品生命周期；<br/><br/>2、调研并分析市场情况，提出产品发展方向意见和迭代计划；<br/><br/>3、与业务相关部门收集和沟通需求，完成需求评审和需求管理；<br/><br/>4、制定产品开发计划，充分准备产品需求，跟踪UI、开发、测试进度确保产品按时上线，为产品结果负责；<br/><br/>5、协助其他部门完成产品讲解、演示、交流工作；<br/><br/>6、跟踪上线产品的市场效果、用户反馈，收集和主动挖掘改进需求，根据业务需要持续改进产品。<br/><br/>任职要求：<br/><br/>1、本科及以上学历，2年以上产品经理经验；<br/><br/>2、热爱教育行业，至少主导过一款0-1产品设计，参与过多款教育类产品研发的优先；<br/><br/>3、有教师类相关产品背景或经历优先；<br/><br/>4、熟练撰写需求文档和产品原型，具备产品的需求分析和规划能力；并熟练使用相关工具，如（Axure、MindManager、Visio、EA、word、PPT等）<br/><br/>5、具有很强的沟通、协调，组织能力，有很好的抗压能力。能够有效地组织和推进跨职能，跨团队的合作项目；<br/><br/>6、卓越的逻辑思维与分析能力，能够很好的规划和设计产品功能、使用流程与交互体验；<br/><br/>7、思维活跃，逻辑条理清晰，能明确表达自己的想法和见解，自驱力强。,16,1,"{19,15}",{6},,,,,,,,,,,,,,2022-08-20T10:28:38.970821
534296927,3169720599,mid-level-software-developer-%E2%80%93-service-now-or-mobile-and-cloud-services-salary-25-000-to-29-000-cebu-business-park-cebu-city-at-dempsey-resource-management-inc-3169720599,2022-08-20T10:28:44.913165,2022-08-20T10:28:44.913165,,,,"[""2022-05-19 10:28:38.832838"",""2022-08-23 10:28:38.832838"")",261062904,"MID LEVEL SOFTWARE DEVELOPER – SERVICE NOW or MOBILE AND CLOUD SERVICES Salary: 25,000 to 29,000 CEBU BUSINESS PARK, CEBU CITY",10022368,Dempsey Resource Management Inc.,dempsey-resource-management-inc-,,"Cebu, Central Visayas, Philippines",,,,,,,,0,A,"<strong><u>Description<br/><br/></u></strong><strong>Key Responsibilities<br/><br/></strong>A successful Software Senior Developer must have experience in leading Software Development<br/><br/>Projects.<br/><br/>Supervise and mentor team of Software Developers<br/><br/><strong><u>Requirements<br/><br/></u></strong><strong>Job Requirements<br/></strong><ul><li> Graduate of BS Computer Science, Computer Engineering, IT, or a related field</li><li> 3-5 years development experience</li><li> Adept in Android and Web Development languages and frameworks; Web Development using<br/></li></ul>PHP, HTML, jQuery, Java, Angular, React, Laravel or other similar languages and frameworks<br/><ul><li> Considerable familiarity with Mobile Development using native Android, React or other similar<br/></li></ul>languages and frameworks<br/><br/>Global Technologies Corporation<br/><ul><li> Good knowledge in Objective-C or Swift is a plus</li><li> Responsible for deployment in cloud platforms such as Amazon, Google, Azure, or other similar<br/></li></ul>platforms<br/><ul><li> Substantial experience in Mobile application distribution using Google Play Store or Apple App<br/></li></ul>Store<br/><ul><li> In-depth knowledge in MySQL, PostgreSQL, MS SQL, Oracle, or similar databases</li><li> Proficient in server, database, and network administration and troubleshooting</li><li> Strong logical thinking, problem-solving, and analytical skills</li><li> Extensive background in financial industry and technology is a plus</li><li> Proficiency in Japanese language is a plus</li></ul>",3,1,"{13,8}",{104},,,,,,,,,,,,,,2022-08-20T10:28:38.837378
